;LF6655;Saint Jean Pla de Corts;Base ULM Autorisation OBLIGATOIRE ;24/11/2011;19/05/2021;14/10/2025;42.519608,2.810590;N 42 31 11;E 002 48 38;270 ft;"Tour de piste à l'EST 1000ft QNH. Piste 33 légèrement montante. 


ATTENTION : seuil de piste 33 décalé de 233 m présence d'un câble de téléski nautique à 50 m du seuil et à 7 m de hauteur.


Terrain d'aéromodélisme et drônes à 2 km au 193°.


ATTENTION : en fin de vent arrière/15 main gauche, rester au moins à 600 ft QNH minimum au niveau des panneaux photovoltaïques car ils font fréquemment l'objet de travaux par drones.";1;herbe;'33;15;400;'15-33;;;;;;125.335;;0;invalid;garcesregis4@gmail.com;+33 4 68 83 03 64;"terrain entouré d'une clôture électrique...hauteur : 60 centimètres


VOIR INFOS DE DECALAGE DE SEUIL DE PISTE





ATTENTION: surface de la piste parfois abîmée par les sangliers(me téléphoner pour les infos).


Zone située à l'intérieur du trait noir( voir photo n° 3) interdite sauf à hauteur réglementaire(500m QFE) mais à éviter quand même pour ménager le voisinage. Eviter également le survol du MAS D'EN BAPTISTA à 1,5 km au SE ( voir photos).";
;LF6656;Montescot;Base ULM Accès privé;06/05/2011;29/11/2015;14/04/2023;42.611667,2.9388890000000174;N 42 36 42;E 002 56 20;55 ft;"Terrain réservé aux pilotes ayant obtenu l'accord du propriétaire avant de venir (pb d'environnement).


Tour de piste au nord.";1;herbe;;0;300;'12-30;herbe;;;;'Inconnue;125.335;;0;invalid;;+33 6 12 22 96 29;"Problèmes d'environnement.


Attention, en cas de vent Marin, turbulences en courte finale.


Activités AEM 9641 (plafond 350ft ASFC) et 9642 (plafond 500ft ASFC) à proximité.";Jean-Philippe GRAVAS
oui;LF6657;Corneilla del Vercol;Base paramoteurs fermée définitivement.;30/04/2011;25/06/2014;09/08/2014;42.620833,2.934722;N 42 37 15;E 002 56 05;;;1;herbe;;350;350;'omnidir;herbe;;;;'Inconnue;;;;;;+33 6 70 48 49 27;"Terrain paramoteur uniquement.


Fermé.


Transfert de l'activité en cours.";
;LF6658;Llauro;Aérodrome fermé.;06/06/2013;22/04/2024;18/12/2025;42.55027777777801,2.730906091266206;N 42 33 01;E 002 43 51;1411 ft;"Terrain à caractère d'altisurface. 


Atterrissage possible uniquement en 24.


Pente moyenne 18% environ,


Eloignement cap 010° et tour de piste au nord-est.


Eviter le survol des villages voisins Tordères et Llauro.";1;terre;'24;30;300;'06-24;herbe;;;;'Inconnue;123.065;aucun;0;invalid;;+33 4 68 38 81 54;Terrain privé. Autorisation préalable auprès du propriétaire Mr Gispert.;Mr Michel GISPERT
;LF6659;La Salanque Latécoère;Hydrosurface fermée.;18/08/2015;22/07/2022;24/07/2022;42.816666666667,3;N 42 49 00;E 003 00 00;;"Disque de rayon 500m





Survol base militaire de St-Laurent-de-la-Salanque (LF-R73) interdit. ";1;eau;;1000;1000;'omnidir;herbe;;;;'Inconnue;;;3,6,4,5;Restauration sur place, Restauration &agrave proximité, Gîte à proximité, Camping possible;jfmonier@hydroclubdefrance.fr;+33 6 70 27 50 40;"Usage occasionnel, réservé aux participants de manifestations aériennes, interdit le reste du temps.


Contacter le gestionnaire pour plus d'information.";Hydro-Club de France
;LF6661;ST LUC Passa;Aérodrome privé. Pas de visiteurs.;23/08/2020;19/03/2023;20/03/2023;42.57600287672764,2.816812972244267;N 42 34 34;E 002 49 01;262 ft;Survol du village de Passa strictement  interdit  .;1;terre;'22;20;500;'04-22;herbe;;;;'Inconnue;125.335;;0;invalid;maphdufour@gmail.com;; ;Dufour Philippe
;LF6715;Club Ulm Kogenheim;Base ULM Accès privé;15/11/2011;23/04/2023;25/04/2023;48.323055555556,7.534722222222172;N 48 19 23;E 007 32 05;528 ft;"Tour de piste à l'Est et à 500ft AGL soit 1000ft QNH


Verticale terrain est à 1000ft AGL soit 1500ft QNH


La partie Ouest jusqu'à la piste est réservée aux paramoteurs.


Autorisation par SMS nécessaire";1;herbe;'02;30;180;'02-20;herbe;;;;'Inconnue;125.335;sur demande;6;Restauration &agrave proximité;info@ulmkogenheim.com;+33 6 76 54 60 31;"Décollage :


En 02 : montée initiale puis virage à droite dès que possible


En 20 : montée initiale puis virage à gauche dès que possible


Ligne HT (h. 170ft) à 700m au Sud des installations


Survol des villages alentours interdits !


Merci de ne pas survoler la zone à moins de 1000ft afin de préserver la tranquillité de la faune (réserve naturelle protégée) et des riverains. 


Autorisation par SMS obligatoire (prévenance 72h pour drones)";Club ULM de Kogenheim
;LF6721;Albé - Val de Villé;Aérodrome Privé Ouvert aux ULM;06/07/2011;13/11/2022;15/11/2022;48.34917234770277,7.330399649143278;N 48 20 57;E 007 19 49;1247 ft;"Atterrissage impératif au QFU 08 suivant une base main droite





Décollage impératif au QFU 26 puis virage à gauche en évitant le survol de la ville de Ville





Pente moyenne régulière 5 %";1;dur;'08;20;415;'08-26;herbe;;;;'Inconnue;123.500;;6;Restauration &agrave proximité;riotte.christian@free.fr;+33 06 72 62 66 22;"PPR (Permission Préalable Requise)


Verticale obligatoire à 1800ft QNH car activité aéro-modélisme fréquente


Ne pas survoler le village de vacances d'Albéville situé à 700m dans l'Axe du terrain.


Présence d'une colline d'altitude 1330 pieds à 900 m dans l'axe





L'usage du terrain est réservé aux aéronefs basés et aux seuls pilotes autorisés par l'exploitant de l'aérodrome.





Piste en pente encaissée dans le relief, turbulences en cas de vent.";M. RIOTTE Christian
;LF6723;Salmbach;Base ULM Accès privé;08/03/2011;16/02/2017;14/04/2023;48.967978944929,8.070922861099234;N 48 58 05;E 008 04 15;508 ft;;1;herbe;;20;280;'09-27;herbe;;;;'Inconnue;125.335;;0;invalid;;+33 6 12 58 47 82;"Seul 250M de piste sont utilisable à cause d'une forte pente en 09 et d'un ravin en seuil de la 27.


Faire un passage bas au préalable afin d'évaluer l'état de la piste (dégâts de sanglier)";
;LF6724;Wissembourg;Base ULM Privé Avec Restrictions Autorisation OBLIGATOIRE ;08/03/2011;07/01/2024;09/01/2024;48.992476585066,7.975869985458303;N 48 59 33;E 007 58 33;152 ft;Tour de piste EST à 1100ft QNH;1;herbe;;40;280;'18-36;herbe;;;;'Inconnue;125.335;;0;invalid;josephdeschaller@gmail.com;+33 6 51 12 83 72;Merci de contacter Mr SCHALLER au préalable.;Club ULM de Wissembourg
;LF6751;Batzendorf;Base ULM ouverte tous types;13/10/2011;14/07/2024;16/07/2024;48.80304652931447,7.72666700000002;N 48 48 11;E 007 43 36;560 ft;"Tour de Piste obligatoire au-dessus de la forêt au nord des installations.


Éviter impérativement les fermes et maisons en finale 08 (voir plan sur photo)


QFU 08-26. Attention à la butte au seuil de piste 26. Un passage bas est conseillé au préalable.";1;herbe;'08;30;285;'08-26;herbe;;;;'Inconnue;125.335;Station à 2 km;6,2,4,5;Restauration &agrave proximité, Hangar possible, Gîte à proximité, Camping possible;bul.batzendorf@gmail.com;+33 7 81 47 77 35;"Possibilité de hangar pour 1 multiaxes, 1 pendulaire, 1 Autogire. 10€/nuit sur présentation d'assurance





Vigilance : Piste très technique. Clôture et butte de terre en seuil de piste 26. Un passage bas pour une reconnaissance est conseillé avant un complet !  Lignes THT à proximité à 300m au Sud. Carrière en activité à l'Est au bout de la 08.


Prenez les consignes et conseils avant de venir vous poser auprès des contacts ci-joints.";Président du club
;LF6752;Trimbach;Base ULM Accès privé;08/03/2011;31/12/2015;14/04/2023;48.938055555556,8.007777777777846;N 48 56 17;E 008 00 28;574 ft;"PPR obligatoire !


Tout atterrissage sans autorisation obtenue préalablement est interdit. Atterrissage en 08 et décollage en 26.";1;herbe;'08;15;500;'08-26;herbe;;;;'Inconnue;125.335;;;;volkmar.balzer@cal-aviation.com;+49 1 71 414 43 97;PPR OBLIGATOIRE;
;LF6754;Envol Ulm Alsace;Base ULM Privé Avec Restrictions Autorisation OBLIGATOIRE ;25/07/2011;16/10/2023;25/01/2026;48.151111,7.536728;N 48 09 04;E 007 32 12;576 ft;"Verticale à 1500ft QNH


Tour de piste à l'EST à 1000ft QNH





Pas de survol des agglomérations environnantes !";1;herbe;'36;30;312;'18-36;;;;;;125.335;;2;Hangar possible;freddy.rieb@gmail.com;33677346374;"PPR (Permission Préalable Requise) du gestionnaire.


Le contacter par téléphone";ASSOCIATION ENVOL ULM ALSACE
;LF6755;Hanau-Airport-Schillersdorf;Base ULM Accès privé;22/08/2012;01/08/2024;06/08/2024;48.870934847561585,7.51704702377333;N 48 52 15;E 007 31 01;676 ft;"Nouveauté : Manche à Air sur le terrain


Attention, clôture électrique et poteaux en bout de piste 33.


Faire un passage bas au préalable afin d'évaluer l'état et l'accessibilité de la piste.


Si vaches en pâturage atterrissage formellement interdit !


";1;herbe;'33;30;265;'15-33;herbe;;;;'Inconnue;125,335;sur demande;6,4;Restauration &agrave proximité, Gîte à proximité;michelmahler@aol.com;+33 7 81 47 77 35;"MANGER :   


- Hôtel-Restaurant ERNENWEIN  à Obermodern   03 88 90 80 08    (3Km) 


  https://www.ernenwein.com/restaurant/





SE LOGER au Village: 


- Sbürehiesel : www.sburehiesel-schillersdorf.fr


- Au Freidbarry : www.freidbarry.com   


- Le Clos Bleu : www.leclosbleu.fr          ";MAHLER Michel
oui;LF6756;terrain privé ULM;Base ULM fermée définitivement;23/08/2012;23/08/2012;24/08/2012;48.87116772708362,7.516896820068382;N 48 52 16;E 007 31 01;222 ft;;1;herbe;;30;265;'15-33;;;;;;Auto info 123,5;;;;;;;
;LF6757;Les Cigognes d'Epfig;Base ULM Autorisation OBLIGATOIRE ;06/11/2012;05/03/2025;06/03/2025;48.33847065517495,7.477790306939028;N 48 20 18;E 007 28 40;552 ft;"http://cigognesepfig.free.fr/index.php/plans





Survol interdit de la scierie à proximité et maisons lieu-dit 'poulailler'


ATTENTION : L'ancienne piste dite 'Bande Stirmel' n'est plus utilisable actuellement .


 Instructions affichées sur le cabanon";1;herbe;;200;200;'omnidir;herbe;;40;200;'omnidir;125.335;;6;Restauration &agrave proximité;meyer_julien@ymail.com;+33 6 47 94 75 59;;Président 
;LF6758;Adventure Paramoteur Alsace;Base Paramoteurs Privée Ouverte aux ULM sur autorisation;26/05/2020;26/05/2020;28/05/2020;48.70915863716047,7.7372157864440805;N 48 42 33;E 007 44 14;459 ft;Intégration à 500 pieds QFE en pt8 ;1;herbe;;150;160;'omnidir;herbe;;;;'Inconnue;;;0;invalid;paramoteur67@gmail.com;+33 6 20 71 87 00;Seuls les membres du club peuvent utiliser librement le terrain, pour les autres paramotoristes, contactez Pierre Fritsch au 0620718700;adventure Paramoteur Alsace
;LF6759;JO'AILES ULM;Base Paramoteurs Privé Avec Restrictions Autorisation OBLIGATOIRE ;28/10/2023;28/10/2023;31/10/2023;48.88842272660266,7.686076615025477;N 48 53 18;E 007 41 10;607 ft;survol village interdit, attention aéromodélisme au sud ;1;herbe;;60;60;'omnidir;herbe;;;;'Inconnue;;;0;invalid;joailes.ulm@gmail.com;33633811651;Survol du village interdit, attention piste aéromodélisme au sud;Jo'Ailes ULM Club
;LF6821;Masevaux;Aérodrome Privé Ouvert aux ULM;08/03/2011;23/12/2015;06/01/2016;47.804266653725,6.946253555541944;N 47 48 15;E 006 56 47;1500 ft;"Décollage par composante de vent arrière très dangereux ! 





Atterrissage impératif QFU 31





Ne pas se poser sur les 50 premiers mètres car sol lourd





Attention aux arbres en entrée de piste





Décollage impératif QFU 13.";1;herbe;'31;20;400;'13-31;herbe;;;;'Inconnue;;;;;;+33 3 89 82 45 80;Aérodrome privé de type altisurface. PPR OBLIGATOIRE.;
;LF6822;Vieux-Ferrette;Base ULM Accès privé;02/12/2011;25/06/2021;14/04/2023;47.51590579438721,7.306944444444412;N 47 30 57;E 007 18 25;1499 ft;"Intégration 2500ft, tour de piste 2000ft à l'ouest, 19 en main droite


Survol des villages avoisinants et des fermes à l'Ouest prohibé.





Riverains sensibles, respecter les consignes et observations.





Attention piste synthétique (Plaques Terra-Grid).";1;herbe;;20;305;'01-19;herbe;;;;'Inconnue;125.335;;6,4;Restauration &agrave proximité, Gîte à proximité;info@ulm-regio.eu;+33 6 06 44 49 97;"Avis de vol requis, avec


- le type, la couleur et l'immatriculation de l'aéronef,


- le nom, prénom et N° de tel. du commandant de bord,


- la date et heure approximative d'arrivée prévue,


 soit par mail à info@ulm-regio.eu ou SMS à 06 06 44 49 97 (l'avis vaut autorisation),





Les  tours de piste ou autre exercice d'entrainement sont interdits aux pilotes et aéronefs non basés.





.Le téléphone principal n'est accessible que par SMS.


";Club ULM-Regio de Vieux Ferrette
oui;LF6851;Valdieu Lutran;Base ULM fermée définitivement;08/03/2011;28/02/2016;23/09/2020;47.62223795072,7.045828464296164;N 47 37 20;E 007 02 45;1132 ft;Tour de piste obligatoirement au SUD de la piste à 1700 ft AMSL.;1;herbe;;20;200;'08-26;herbe;;;;'Inconnue;123.500;sur demande;2;Hangar possible;contact@voldecouverte.fr;+33 3 89 07 22 87;"Eviter 'largement' le survol des maisons et villages voisins





Ligne haute tension au nord et nord-ouest de la piste





Barrière d'un mètre de hauteur au début de la piste 26





Faire un passage bas pour les multis (mêmes légers) car la piste peut être en mauvais état ...en plus d'être très courte.





Pour le hangar, merci de contacter le propriétaire pour se renseigner.";A.E.P. Valdieu-Lutran / section ULM
;LF6852;Soppe;Base ULM ouverte tous types;08/03/2011;06/06/2022;14/04/2023;47.72546609657504,7.097029649490434;N 47 43 32;E 007 05 49;1099 ft;"Tour de piste obligatoire à l'OUEST de la piste et à 500ft AAL (1600ft QNH)


Survol de Soppe-le-bas strictement interdit


Intégration obligatoire par l'est 





Piste préférentielle 23 si vent  < 2m/s








";1;herbe;'23;30;350;'05-23;herbe;;;;'Inconnue;125.335;sur réservation;6,2,4,5;Restauration &agrave proximité, Hangar possible, Gîte à proximité, Camping possible;jc.barb@orange.fr;+33 6 0229 96 09;"Ligne haute tension à l'ouest et au sud de la piste (elle traverse l'axe de la piste au sud)





Seuil de la piste 05 décalé à cause de la distance minimale reglementaire 450 m par rapport à la ligne haute tension.


Donc 150 m de la piste utilisable en 05 et 300m en 23








ATTENTION : présence d'une cloture électrique aux entrées de piste de 60 cm de haut (pour éviter l'intrusion des sangliers) 








président  jean-claude barb 0602299609





";"Association Les Faucheurs de Marguerites"""""
oui;LF6921;Claveisolles;Altisurface fermée;08/03/2011;17/05/2016;19/10/2017;46.078056,4.5458701666565275;N 46 04 41;E 004 32 45;2463 ft;"altisurface fermée définitivement depuis mars 2013.





Altisurface bordée de chaque côté de forêts. Au seuil de piste 13, une trentaine de mètres a été dégagée des arbres (non roulable)";1;herbe;'13;18;240;'13-31;herbe;;;;'Inconnue;;;0;invalid;;+33 4 74 71 74 75;"Avions : Qualification Montagne requise.


ULM : Libre d'accès.


PILOTES ULM : Pour votre sécurité et pour obtenir les dernières consignes, veuillez contacter le PNVM (Pôle National Vol Montagne) au 0698282850 ou 0683512668.


Selon le site de l'afpm le site Claveisolles est définitivement fermé à la demande de son propriétaire.";
;LF6951;Saint Jean d'Ardières;Base ULM ouverte tous types;08/03/2011;13/10/2018;23/08/2023;46.129444,4.742778000000044;N 46 07 46;E 004 44 34;610 ft;"Tour de piste : 


01/19 à l'Est 500 ft AAL - Préf. 19. 


27/09 au Nord 500 ft AAL - Préf. 27 


Intégration standard pour les 2 pistes.";2;herbe;'19;24;330;'01-19;herbe;'27;24;330;'09-27;125.335;à 2 km;4,5;Gîte à proximité, Camping possible;nbernard69@orange.fr;+33 6 23 11 74 59;"Terrain dégagé. Manche à air sur le faîte du hangar.


Atterrissage en 19 : ligne téléphonique à 150 m au nord du seuil de piste. 


Atterrissage en 01 : lotissement  avant le seuil de piste.


Atterrissage en 09 : fossé au seuil de la 09 


Hôtels à Belleville et Saint-Jean-d'Ardières. Carburants à 2 km";BERNARD Noël
;LF6953;Le Parasoir;AltiSurface en service ;28/02/2018;26/03/2020;18/12/2025;46.03197181742679,4.555785083143974;N 46 01 55;E 004 33 21;2110 ft;"Atterrissage en 24 - Décollage en 06


Tour de piste main D 2300 ft


Pente forte 20 %


Avions : Qualification Montagne requise.


ULM : Formation montagne fortement recommandée !";1;herbe;'24;18;230;'06-24;herbe;;;;'Inconnue;123.065;Non;6;Restauration &agrave proximité;;;"Restaurant 'Le relais du Parasoir' à 100 m, ouvert du mercredi au dimanche


+33 4 74 67 29 89


https://www.leparasoir.com/  


https://www.facebook.com/Le-Relais-du-Parasoir-132198323524344/





Pour obtenir des informations par massif montagneux, vous pouvez vous renseigner auprès des instructeurs labellisés PNVM, liste des contacts sur http://pnvm-ffplum.fr/equipe";M. JUNET Michel
oui;LF6954;Bibost;Base paramoteurs fermée définitivement.;25/03/2018;15/09/2020;21/08/2025;45.79819700277907,4.560196083171718;N 45 47 54;E 004 33 37;1313 ft;;1;herbe;;110;130;'omnidir;herbe;;;;'Inconnue;147;;6,4,5;Restauration &agrave proximité, Gîte à proximité, Camping possible;laurent.cougoulat@gmail.com;+33 7 70 47 79 27;Casque et radio obligatoire sur la base. Autorisation obligatoire en me contactant par téléphone.;COUGOULAT Laurent
;LF7021;Bucey les Gy;Aérodrome Privé Ouvert aux ULM;20/10/2011;23/12/2015;18/12/2025;47.41499180597738,5.871419906616211;N 47 24 54;E 005 52 17;1260 ft;"Tour de piste main gauche. 


Atterrissage en 04, décollage en 22. 


Profil convexe, pente moyenne 5%, début de bande à 8% puis seulement 2%. 


Les 100 premiers mètres ne sont pas utilisables pour le toucher des roues. 


Absence de balisage de piste.";1;herbe;'04;20;425;'04-22;herbe;;;;'Inconnue;123.065;;;;;+33 3 84 32 80 05;"Aérodrome privé de type altisurface. PPR : autorisation préalable nécessaire.





Par vent arrière supérieur à 5 kt, l'atterrissage est problématique";
;LF7022;Francourt;Aérodrome Privé Ouvert aux ULM;21/10/2011;24/12/2015;26/01/2016;47.655126232516,5.73885440826416;N 47 39 18;E 005 44 20;869 ft;;1;herbe;;20;370;'05-23;herbe;;;;'Inconnue;;;6;Restauration &agrave proximité;;+33 3 84 92 04 89;;
;LF7023;Saulnot;Aérodrome Privé Ouvert aux ULM;21/10/2011;24/12/2015;11/05/2021;47.567665988734,6.644754409790039;N 47 34 04;E 006 38 41;1269 ft;"Tour de piste à l'est entre la colline et le village. 


Piste préférentielle 22 sauf si vent > 15 kmh. 


";1;herbe;'22;30;600;'04-22;herbe;;;;'Inconnue;123.500;;6,2,4,5;Restauration &agrave proximité, Hangar possible, Gîte à proximité, Camping possible;gabriel.augerot@orange.fr;+33 3 84 27 44 36;L'accès de la plate-forme est réservé aux personnes autorisées par le gestionnaire qui doit être contacté au 03 84 27 44 36 ou portable 06 07 27 61 06;Augerot Gabriel
oui;LF7024;Broye les Pesmes;Base ULM fermée définitivement;08/03/2011;08/03/2011;10/12/2013;47.33,5.513333;N 47 19 48;E 005 30 48;682 ft;;1;herbe;;;2350;'Inconnue;;;;;;;;;;;;;
;LF7025;Tincey;Base ULM Accès privé;20/10/2011;21/04/2020;14/04/2023;47.606322183432184,5.78580379486084;N 47 36 23;E 005 47 09;764 ft;"Piste bombée. Tour de piste à l'OUEST


Eviter le survol du village


Présence d'un mat de mesure du vent (hauteur 50 m) à 550m au nord de la piste.";1;herbe;'07;26;340;'07-25;herbe;;;;'Inconnue;125.335;sur demande;3,2,4,5;Restauration sur place, Hangar possible, Gîte à proximité, Camping possible;pascal.chambellant70@orange.fr;+33 6 86 00 31 02;Restauration et gîte demande préalable.;Pascal CHAMBELLANT
;LF7026;Arc lès Gray;Base ULM Accès privé;20/10/2011;16/06/2024;18/06/2024;47.475650636459,5.569124221801758;N 47 28 32;E 005 34 09;718 ft;"Côté Ouest


Vigilance par vent d’Est et NE


";1;herbe;;20;340;'18-36;herbe;;;;'Inconnue;125.335;;0;invalid;;+33 6 81 98 64 26;"Prévenir le propriétaire : 06 81 98 64 26





Ecole de pilotage ULM pendulaire : Olivier BON instructeur : 0686084878 - olivier.bonfc@free.fr


Formation, perfectionnement, reprise en main  et  accompagnement  transition vers  monoplace 


Tel: 0686084878";MEIER Christian 
;LF7027;Lambrey;Base ULM Accès privé;20/10/2011;24/12/2015;14/04/2023;47.7676857708,5.938754081726074;N 47 46 04;E 005 56 20;820 ft;;1;herbe;;25;330;'07-25;herbe;;;;'Inconnue;125.335;;;;;;"ATTENTION...


ligne téléphonique le long de la piste


clôture en bois sur pourtour, balisé (blanc) en entrée de piste.";
;LF7028;Venisey;Aérodrome Privé Ouvert aux ULM;20/10/2011;20/06/2023;22/06/2023;47.834347169352,5.9989213943481445;N 47 50 04;E 005 59 56;804 ft;"- Piste préférentielle 02 cause dégagement. (Preferred QFU : 02, due to clearing)


- Eviter le survol des zones habitée. (Avoid overflying built up areas)


- Tour de piste à l'est. (Circuit  east)


- Utilisation RADIO vivement recommandée : 123.5 ";1;herbe;'02;20;700;'02-20;herbe;;;;'Inconnue;123.500;;0;invalid;;+33 6 08 06 18 76;;CUNY
;LF7029;Senoncourt;EPISODIQUE;20/10/2011;08/01/2021;14/04/2023;47.83233056619,6.0530805587768555;N 47 49 56;E 006 03 11;778 ft;"- tour de piste au sud ou par sécurité exceptionnellement au nord en cas de vent fort traversier du sud sud-ouest car finale 30 courte


- éviter le survol du village en étape de base 30


- attention à la clôture en finale 30";1;herbe;'30;20;350;'12-30;herbe;;;;'Inconnue;125.335;Reservation;2;Hangar possible;philippeaeby@orange.fr;+33 6 87 69 73 77;"- Manche à air sur petit hangar.


- Terrain inondable après de fortes précipitations


- contact par tel ou mail conseillé


- 1 place hangar possible actuellement";CLUB libellULM 70
;LF7030;Bay;Base ULM Accès privé;20/10/2011;24/12/2015;14/04/2023;47.301424446879274,5.7042646408081055;N 47 18 05;E 005 42 15;709 ft;;1;herbe;;25;700;'02-20;herbe;;;;'Inconnue;125.335;;0;invalid;;;;
oui;LF7031;Jasney;Base ULM fermée définitivement;20/10/2011;31/12/2024;02/01/2025;47.88269335486,6.169992685317993;N 47 52 58;E 006 10 12;919 ft;;1;herbe;;20;240;'05-23;herbe;;;;'Inconnue;125.335;;0;invalid;;+33 3 84 40 39 23;Ce terrain est totalement impraticable et laissé à l'abandon, en friche.;
;LF7032;La Malachère;Base ULM Autorisation OBLIGATOIRE ;20/10/2011;11/12/2019;14/04/2023;47.448232221127,6.0703325271606445;N 47 26 54;E 006 04 13;925 ft;;1;herbe;;20;250;'09-27;herbe;;;;'Inconnue;125.335;;0;invalid;;+33 3 84 91 84 96;;
;LF7033;Gevigney;Base ULM Accès privé;16/03/2012;22/04/2025;24/04/2025;47.796864119275,5.913150405883812;N 47 47 49;E 005 54 47;720 ft;"hauteur tour de piste 1500ft QNH.


Tour de piste au nord


La présence d'une ligne HT d'une hauteur de 20 m  en bout de QFU 05 implique en cas de doute sur la présentation en finale une remise de gaz au plus tard avant atterrissage QFU 05.


Décollage QFU 23.


";1;herbe;'05;24;500;'05-23;herbe;;;;'Inconnue;125.335;possible;6,2,4,5;Restauration &agrave proximité, Hangar possible, Gîte à proximité, Camping possible;alban.causin@wanadoo.fr;;"La piste est en vallée, le relief limite le vent de travers.


La piste est  inondable, merci de prendre contact  avant utilisation.


Gite  disponible en bord de piste  pour 2 + 2 personnes (1 lit + 1 clic clac) avec chambre, douche, wc ,salon TV, cuisine, coin BBQ, WIFI. 


Carburant possible.


 https://www.chambres-hotes.fr/chambres-hotes_chambre-d-hote-l-escale_gevigney-et-mercey_91093.htm


";
;LF7034;Lacs de Bonnal;HydroSurface privée. Autorisation OBLIGATOIRE ;23/01/2014;26/04/2019;27/04/2019;47.517869892637,6.363868808746247;N 47 31 04;E 006 21 50;816 ft;Tour de piste au Sud-Est en évitant le survol du camping et des cabanes.;2;eau;;100;900;'04-22;eau;;100;500;'02-20;;;3,4,5;Restauration sur place, Gîte à proximité, Camping possible;info@cabanesdesgrandslacs.com;+33 3 84 77 06 72;"Domaine privé : réservé aux membres de l'Association Française d'Hydraviation autorisés par le propriétaire.


Briefing spécifique à signer avant tout vol


Lac Nord Hydravions & ULM


Lac Sud ULM seulement


Attention: 


Lac Nord:  tremplin de ski nautique et de cabanes flottantes


Lac Sud: présence en saison de baigneurs et lignes d'eau.





Camping http://www.camping-valdebonnal.com


Cabanes flottantes: www.cabanesdesgrandslacs.com";Cabanes des Grands Lacs
oui;LF7035;Vereux la Bouloye;Base ULM fermée définitivement;03/06/2014;31/08/2015;09/10/2015;47.51822458302068,5.638669624328592;N 47 31 06;E 005 38 19;;;1;herbe;;;;'13-31;herbe;;;;'Inconnue;;;;;;;;
;LF7121;Sagy;Aérodrome Privé Ouvert aux ULM  Utilisation EPISODIQUE ;08/03/2011;19/02/2023;20/02/2023;46.615451366455,5.35288528836054;N 46 36 56;E 005 21 10;640 ft;"Pas de consignes particulières concernant le tour de piste. Simplement éviter de survoler à basse hauteur les maisons au sud du terrain.


La piste préférentielle pour le poser est la 35. La piste préférentielle pour le décollage est la 17.




















";1;herbe;'35;30;550;'17-35;herbe;;;;'Inconnue;123.500;10 km;6,4;Restauration &agrave proximité, Gîte à proximité;avidphil9@gmail.com;+33 6 49 12 31 26;"Restauration dans le village de Sagy.


Hotel restaurant 


249 rue des Brethenières, 71580 Sagy•03 85 74 07 57 





Merci d'appeler avant de venir, afin que l'on vous communique l'état de la piste et que l'on puisse vous accueillir dans la mesure de notre disponibilité. Vous êtes les bienvenus !";Camus Philippe
