;LF2552;Bonnay;Base ULM Autorisation OBLIGATOIRE ;21/10/2011;23/05/2021;14/04/2023;47.33354403370945,6.035758852958679;N 47 20 01;E 006 02 09;751 ft;"Tour de piste côté NW à 500'QFE. 


Éviter de survoler la ferme dans le tour de piste.";1;herbe;;20;320;'06-24;herbe;;;;'Inconnue;125.335;SP95;0;invalid;ulm25@free.fr;+33 6 07 53 52 00;"Plateforme située à 10 kms de Besançon en direction de Vesoul à proximité de la rivière Ognon en lacets.





Carburant en dépannage possible. 


Pour une quantité supérieure à 20L, prévenir d'avance pour approvisionnement.





Les R45S, R45D, R58C sont actives en semaine: se renseigner";
;LF2553;Fournet Blancheroche;Base ULM ouverte tous types;21/10/2011;02/02/2022;14/04/2023;47.177724661456,6.8135833740234375;N 47 10 40;E 006 48 49;2874 ft;À éviter par vent de sud. Circuit main gauche pour la 05 main droite pour la 23;1;herbe;'05;20;330;'05-23;herbe;;;;'Inconnue;125.335;;4;Gîte à proximité;nicolas.silvant@free.fr;+33 6 71 58 48 16;Webcam:  http://www.ulm-fournet.com/cam1/image.jpg;Club ULM Haut Doubs
;LF2554;Arc sous Cicon;Base ULM Accès privé;20/10/2011;24/12/2015;14/04/2023;47.045826358132,6.3889360427856445;N 47 02 45;E 006 23 20;2608 ft;TP à l'ouest du terrain, ne pas survoler le village, TP interdit.;1;herbe;;20;280;'16-34;herbe;;;;'Inconnue;125.335;;2;Hangar possible;ulmpontarlier@orange.fr;+33 3 81 65 00 52;Place hangar prendre contact avec Yves Dejardin;Dejardin Yves
;LF2555;Athose;Base ULM ouverte tous types;20/10/2011;10/03/2023;14/04/2023;47.076741290411,6.289535865951507;N 47 04 36;E 006 17 22;2360 ft;"Atterrissage 14 en montée


Décollage 32 en descente


Tour de piste à l'ouest


Attention à la clôture électrique au seuil de piste  ";1;herbe;'14;20;230;'14-32;herbe;;;;'Inconnue;125.335;;0;invalid;andre.gresset238@orange.fr;+33 3 81 60 05 98;Places libres à louer pour pendulaires.;
oui;LF2556;Fontaine les Clerval;Base ULM fermée définitivement;03/03/2017;29/09/2018;30/09/2018;47.42067141821,6.462466812133812;N 47 25 14;E 006 27 45;1280 ft;"important :  Approche et Tour de piste en évitant le survol du village








Tour de piste 02  2300 fts circuit vent arrière main gauche





Tour de Piste 20 2300 fts  circuit vent arrière main droite";1;herbe;;60;400;'02-20;herbe;;;;'Inconnue;123,5;;0;invalid;aviateur25@wanadoo.fr;+33 6 32 07 89 96;appelez moi avant de venir poser;
oui;LF2557;La Vrine ULM;Base ULM fermée définitivement;01/02/2018;24/10/2023;07/08/2025;46.976020311385,6.332240200042634;N 46 58 34;E 006 19 56;2707 ft;;2;herbe;;130;160;'omnidir;herbe;'32;40;350;'14-32;125.335;;2;Hangar possible;;+33 6 80 46 33 22;;DOUBS ULM
;LF2558;Liesle;Base Paramoteurs Privée Ouverte aux ULM sur autorisation;17/05/2020;17/05/2020;19/05/2020;47.047708275267766,5.8257716779272295;N 47 02 52;E 005 49 33;853 ft;;1;herbe;;;;'Inconnue;herbe;;;;'Inconnue;;;0;invalid;olivier-paramoteur@orange.fr;+33 6 62 30 91 22;;OLIVIER PARAMOTEUR
;LF2621;Faucon;Aérodrome Privé Ouvert aux ULM;14/11/2011;18/02/2017;18/12/2025;44.536944444444,5.308611111111077;N 44 32 13;E 005 18 31;3300 ft;"Aérodrome à caractéristique d'altisurface.


Sens du tour de piste au choix du pilote.


Atterrissage en 20 : pente 20%.150 m, puis 12 % 250m 


Après de fortes ou longues pluies, possibilité que la piste soit ravinée. Turbulences en finale par vent fort.";1;herbe;'20;20;400;'03-21;herbe;;;;'Inconnue;123.065;;;;;+33 4 75 27 22 40;"vidéo de démonstration atterrissage et décollage : http://vimeo.com/34210712





manche à air et balisage";
;LF2622;Bellegarde en Diois;Aérodrome fermé.;08/03/2011;26/09/2023;18/12/2025;44.553601249902584,5.4384383888855155;N 44 33 13;E 005 26 18;3378 ft;;1;herbe;'06;20;200;'06-24;herbe;;;;'Inconnue;123.065;;6,4;Restauration &agrave proximité, Gîte à proximité;;;"Vérifier l'absence de cailloux, éboulement possible


Impraticable après vent et pluie > 8kt


Pente 19 % concave";
;LF2623;Col de Bacchus;AltiSurface en service ;06/06/2014;05/05/2021;18/12/2025;44.85330640610763,5.1691363503418675;N 44 51 12;E 005 10 09;3200 ft;"tdp main gauche att 04 pente 14 % régulière deco 22.


turbulences en entrée de piste par vent sud


sol irrégulier peu aménagé - attention aux vaches


parking en haut à droite


à utiliser à l'intérieur des balises


les derniers 100m seulement en POR


";1;terre;'04;20;350;'04-22;herbe;;;;'Inconnue;123.065;non;0;invalid;;+33 4 75 76 42 15;"Avions : Qualification Montagne requise.


ULM : Libre d'accès. Il est conseillé d’avoir au préalable suivi le cursus de formation au vol montagne proposé par le PNVM.


PILOTES ULM : Pour obtenir des informations par massif montagneux, vous pouvez vous renseigner auprès des instructeurs labellisés PNVM, liste des contacts sur http://pnvm-ffplum.fr/equipe


Seules les fiches accessibles sur le site de l 'AFPM sont valides et tenues à jour.";
;LF2624;L'Escoulin;AltiSurface en service ;08/03/2011;28/02/2019;15/09/2020;44.81613064489334,5.220288505467806;N 44 48 58;E 005 13 13;2345 ft;" Att 36, déco 18, tdp main D à 2600 ft


Utilisation dangereuse par vent du Nord.


1 seul atterrissage (risque de fermeture du terrain)


pas de tours de piste avant 9h ni entre 12h30 et 14h 


ne pas survoler la maison en début de finale";1;terre;'36;23;355;'18-36;herbe;;;;'Inconnue;;;0;invalid;;+33 6 08 62 72 48;"Altisurface utilisable en toutes saisons, été comme hiver sur skis. 


Sol naturel aménagé


Parking de surface réduite au sommet


Avions : Qualification Montagne requise


ULM : Libre d'accès. Il est conseillé d’avoir au préalable suivi le cursus de formation au vol montagne proposé par le PNVM.


PILOTES ULM : Pour obtenir des informations par massif montagneux, vous pouvez vous renseigner auprès des instructeurs labellisés PNVM, liste des contacts";AFPM
;LF2628;Etoile Rhône;Base ULM Accès limité Autorisation OBLIGATOIRE ;11/07/2011;13/03/2024;14/03/2024;44.830831039395356,4.866098254627658;N 44 49 51;E 004 51 58;345 ft;"Voisinage sensible, respecter strictement le tour de piste.


Tour de piste à l'ouest de l'autoroute.


Éviter le survol d’Étoile.


Lignes électriques au sud du terrain.





* Tours de piste successifs limités à 2 pour les aéronefs non basés.";1;herbe;'20;30;450;'02-20;herbe;;;;'Inconnue;125.335;;0;invalid;folairvanne26@gmail.com;+33 6 76 70 37 49;;Club ULM ETOILE
;LF2629;Ratières Les Allandaines;Base ULM Autorisation OBLIGATOIRE ;04/12/2011;29/12/2017;25/06/2025;45.166063037494894,4.979145526885986;N 45 09 58;E 004 58 45;886 ft;"18 préférentielle au décollage, 36 préférentielle à l'atterrissage





ATTENTION : Ligne électrique au seuil 18 (hauteur 6m).


Donc, par vent du sud, bien visualiser la ligne entre les poteaux peints (rouge/blanc)...";1;herbe;'36;30;200;'18-36;herbe;;;;'Inconnue;125.335;sur préavis;2,5;Hangar possible, Camping possible;;+33 4 75 45 15 53;"Contacter propriétaire et président de TOUR'AIR ULM:


Gérard OGER 04 75 45 15 53";Oger Gérard 
;LF2651;Base ULM Anthony Delluc;Base ULM Autorisation OBLIGATOIRE ;27/08/2011;26/12/2015;14/04/2023;45.012017847875,5.08392333984375;N 45 00 43;E 005 05 02;656 ft;"particularité : 


on pose face au hangar en piste 12


on décolle sens inverse en piste 30





Eviter le survol des maisons au décollage, piste délicate avec du vent contacter Claude Delluc au 06 07 96 65 30";1;herbe;'12;30;300;'12-30;herbe;;;;'Inconnue;125.335;;6,2,4;Restauration &agrave proximité, Hangar possible, Gîte à proximité;info@ulmevasion26.com;+33 6 07 96 65 30;;Delluc Claude
oui;LF2652;Serre Mottaire;Altisurface fermée;08/03/2011;06/12/2013;10/12/2013;44.712222,5.691667;N 44 42 44;E 005 41 30;5000 ft;Se renseigner avant d'envisager d'y atterrir. Piste rudimentaire. Il faut un appareil avec des bonnes suspensions.  Ne pas s'écarter de la piste ! Atterrissage en 36, décollage en 18.;1;herbe;'36;25;440;'18-36;;;;;;;;;;;+33 4 92 58 51 81;"Altisurface située sur la face Sud de la Serre Mottaire. Uniquement ouverte du 25 octobre au 10 juin (pâturages en été) !





Se rapprocher de l'AFPM http://www.afpm.fr pour plus de renseignements.";
oui;LF2653;Ratières;Base ULM fermée définitivement;03/12/2011;17/06/2012;04/07/2012;45.166123552765086,4.978952407836914;N 45 09 58;E 004 58 44;800 ft;"Atterrissage préférentiel en 36 LDA 200m


 Petit fossé en amont du seuil


Ligne de 7m au seuil 18.


18 seuil décalé, LDA 150m.";1;herbe;;30;200;'18-36;;;;;;;5 Km;6,2,4,5;Restauration &agrave proximité, Hangar possible, Gîte à proximité, Camping possible;;+33 4 75 45 15 53;"Contacter le propriétaire et Président de TOUR'AIR ULM: Gérard OGER 04 75 45 15 53





Ce terrain est identique à LF2629";
oui;LF2654;ETOILE SUR RHONE;Base ULM Autorisation OBLIGATOIRE ;07/04/2013;07/04/2013;09/04/2013;44.829654663196,4.868814943594316;N 44 49 47;E 004 52 08;377 ft;;1;herbe;'20;20;250;'02-20;;;;;;123.5;;;;folairvanne@free.fr;+33 4 75 60 76 95;;
;LF2655;Saint-Martin;Base ULM Accès privé;29/09/2014;04/01/2024;07/01/2024;44.588052846558114,5.541366259256961;N 44 35 17;E 005 32 29;3205 ft;"Formation montagne recommandée


Intégration main gauche aux deux QFU


2 atterrissages max


Ne pas survoler Lesches-en-Diois et Beaurières.


Site adapté à des machines STOL. Vérifiez vos performances


Risque de fortes turbulences et gradient par vent fort";1;herbe;;16;250;'16-34;herbe;;;;'Inconnue;125,335;;6,2,4;Restauration &agrave proximité, Hangar possible, Gîte à proximité;club.ulm.haut.diois@gmail.com;+33 6 80 52 87 47;"Autorisation préalable obligatoire par mail ou SMS


Sol inutilisable hors piste et stationnement balisé


Pente 2% montante vers le NW


Piste inondable après fortes pluies


Fossé de part et d'autre de la piste balisé par cônes rouges


Par vent d'est, présence possible de parapentes avec atterrissage dans la partie NW du terrain





Chambres d'hôte La Cupidone : 06 24 22 26 89/06 80 52 87 47


Restaurant  'Le Bistrot' : 07 68 08 26 66";"Club ULM du Haut Diois Les engoulevents"""""
;LF2656;Aix en Diois;AltiSurface. Contact préalable impératif.;10/03/2024;10/03/2024;18/12/2025;44.68935810873355,5.408618273224355;N 44 41 22;E 005 24 31;1730 ft;"Tour de piste main droite


Pente 2% sur 300 m QFU 16


Seuil décalé QFU 34 


Par vent arrière inf à 8Kt utiliser QFU 16 préférentiel";1;herbe;'16;30;600;'16-34;herbe;;;;'Inconnue;123.065;;0;invalid;;+33 6 79 88 67 15;"Avions : Qualification Montagne requise.


ULM : Libre d'accès. Il est conseillé d’avoir au préalable suivi le cursus de formation au vol montagne proposé par le PNVM.


PILOTES ULM : Pour obtenir des informations par massif montagneux, vous pouvez vous renseigner auprès des instructeurs labellisés PNVM, liste des contacts sur http://pnvm-ffplum.fr/equipe";
;LF2721;Saint Cyr La Campagne;Aérodrome privé. Pas de visiteurs.;16/11/2011;13/11/2022;15/11/2022;49.25291767344149,1.0284742712974548;N 49 15 11;E 001 01 43;370 ft;"Visiteurs non désirés.


Piste courte, style porte-avion.";1;dur;;0;540;'04-22;herbe;;;;'Inconnue;123.500;;0;invalid;;;"Mr Mathiot Jean pilote et retraité (tél sur liste rouge).





Certains pilotes nous ont remontés l'info qu'il accueille les pilotes de passage non autorisés à coup de fusil, ou bien les chiens sont lâchés ....";
;LF2722;Berville sur Mer;Base ULM Privé Avec Restrictions Autorisation OBLIGATOIRE ;08/03/2011;12/10/2020;13/10/2020;49.435833,0.3636109999999917;N 49 26 09;E 000 21 49;16 ft;"Décollage et atterrissage en direction du lit de la seine.


Au nord Vol interdit zone protégée.


Au sud , Village.";1;herbe;;;;'08-26;herbe;;;;'Inconnue;118.30;;0;invalid;;+33 6 68 63 08 42;"Terrain non carrossable privé exploité par un agriculteur pâturage de bovins dans l'ensemble de la surface.


Terrain situé dans la CTR de Deauville.


Terrain situé sur la  zone de réserve naturelle de la baie de Seine.


Ligne électrique haute tension.


Parcelle divisée en trois par des clôture de barbelé.


Vol occasionnel gendarmerie.


Village au abord de la prairie, attention nuisance sonore.";ULM V.T.T
oui;LF2723;Breuilpont;Base ULM fermée définitivement;08/03/2011;06/11/2020;15/12/2024;48.959866156203,1.4383759153442952;N 48 57 36;E 001 26 18;312 ft;Atterrissage obligatoire en 12.;1;herbe;'12;0;300;'12-30;herbe;;;;'Inconnue;;;0;invalid;;+33 2 32 36 31 39;;M. Placier
;LF2751;Les Noyers;Base ULM Autorisation OBLIGATOIRE ;25/09/2011;24/12/2015;14/04/2023;49.259794955262,1.661360263824463;N 49 15 35;E 001 39 41;328 ft;Tours de piste au Nord sur la 24/06 et à l'Est sur la 15/33 400FT QFE.;2;herbe;;25;400;'06-24;herbe;;20;400;'15-33;125.335;;;;;+33 6 80 88 24 34;Base ULM 3Axes, pendulaires, giros, paramoteurs.;
;LF2752;Cesseville Ferme des Moulins;Aérodrome fermé.;08/03/2011;20/08/2017;11/07/2024;49.17826894394,0.9964688597784743;N 49 10 42;E 000 59 47;485 ft;"Tour de piste: avion 700 ft/sol / ULM 500 ft/sol. 


Aérodrome situé sous la TMA d'Evreux.";1;herbe;;40;600;'07-25;herbe;;;;'Inconnue;123.500;;0;invalid;nidailes@orange.fr;+33 6 07 76 07 96;"PPR : Accès sous autorisation du gestionnaire (voir plus haut). 


Accès libre aux pilotes basés. 





piste longueur 550 m en 07: cause chemin C3 au seuil 07)





contact : Mr Jacques Llavador mobile 06 10 82 30 83";Crevel François
;LF2753;Val de Reuil;Aérodrome Privé Ouvert aux ULM;30/07/2011;15/03/2025;21/01/2026;49.281575,1.231535;N 49 16 54;E 001 13 54;33 ft;"Verticale terrain à 1000 ft/sol. Tour de piste coté Est uniquement (repère coté Seine) à 500 ft/sol. 


Après de fortes précipitations, éviter le premier tier de la piste 01.";2;herbe;'19;30;480;'01-19;herbe;'05;30;350;'05-23;123.500;sur demande;5;Camping possible;ulm.calhn@gmail.com;33 608 659 448;"AD privé, AUTORISATION OBLIGATOIRE, en bordure de la CTR de Rouen et sous la TMA d'EVREUX de classe D.


Attention au point Sierra (écluses de Poses, 3km au Nord) situé à l'intérieur de la CTR de Rouen, nombreux avions en transit. 


Zones en rouge interdites de survol.


Attention à la zone orange, treuillage de parapente au dessus du lac des deux amants.


Vélo sur demande


Gîte selon disponibilité 0664047692";Club d'Aviation Légère de Haute-Normandie
oui;LF2756;LF2754;Base ULM Autorisation OBLIGATOIRE ;05/04/2012;05/04/2012;23/12/2012;49.287842231625,0.6240949575333161;N 49 17 16;E 000 37 27;328 ft;;1;herbe;'03;22;315;'03-21;;;;;;Auto-info 123.5;;;;tranchant.richard@wanadoo.fr;;TEL PRP 0674149543;TRANCHANT RICHARD
;LF2757;La Croisille;Aérodrome privé fermé temporairement;05/09/2023;11/10/2024;13/10/2024;48.992590297734594,0.9668206773098031;N 48 59 33;E 000 58 01;482 ft;Observation : aérodrome privé, interdit aux avions extérieurs par arrêté préfectoral. ;1;terre;'11;28;600;'11-29;herbe;;;;'Inconnue;123.500;NIL;0;invalid;n.lecerf@wanadoo.fr;+33 7 62 18 79 49;"Tour de piste avion 700 ft/sol


Aerodrome situé sous la TMA d'Evreux et en bordure de la CTR";
;LF2758;Vesly;Base Paramoteurs Privée Ouverte aux ULM sur autorisation;15/01/2026;19/01/2026;20/01/2026;49.233849,1.630809;N 49 14 02;E 001 37 51;328 ft;"FRÉQUENCE VOL LIBRE UTILISÉ SUR LE TERRAIN 145.550Mhz


FINALE OMNIDIRECTIONNEL";1;herbe;;080;120;'omnidir;;;;;;;;1,6;Atelier ULM, Restauration &agrave proximité;dyvesairpub@wanadoo.fr;+33 6 07 24 84 80;FRÉQUENCE VOL LIBRE UTILISÉ SUR LE TERRAIN 145.550Mhz;Exploitant
;LF2822;Champrond Le Petit Bois Landry;Aérodrome Privé Ouvert aux ULM;31/10/2011;13/11/2022;15/11/2022;48.393792233174,1.0574984550476074;N 48 23 38;E 001 03 27;853 ft;"Verticale terrain obligatoire à 1400 ft ASFC. 


Tour de pistes : pour la piste 05R/23L de 600m 


Gauche en 23 et Droite en 05


piste 05L/23R de 150m : Droite en 23 et Gauche en 05.


En l'absence de manche à air, ne pas se poser.";2;herbe;;21;600;'05-23;herbe;;20;150;'05-23;123.500;;0;invalid;jfvirgaux@me.com;+33 6 76 85 05 62;"Aérodrome privé. PPR : Pour les avions, autorisation écrite obligatoire du gestionnaire pour utilisation de l'aérodrome (norme administrative légale pour que la Préfecture vous ajoute sur la liste des pilotes autorisés après avis de la DSAC, de la Police de l'Air, des Douanes)





Procédure identique pour les ulms pour bénéficier de la « mise à disposition » de notre aérodrome.





";AEROB612
;LF2823;Loulappe;Aérodrome Privé Ouvert aux ULM;19/10/2011;21/10/2016;23/10/2016;48.438397556039,1.2744998931884766;N 48 26 18;E 001 16 28;577 ft;"Tour de piste à l'ouest 500 ft sol


Légère montée en 36";1;herbe;;15;500;'18-36;herbe;;;;'Inconnue;123.55;;;;;+33 6 09 90 91 89;ligne à haute tension à proximité;
;LF2825;Santilly;Aérodrome Privé Ouvert aux ULM;28/09/2011;18/07/2016;12/03/2025;48.158843186973,1.8533849716186523;N 48 09 32;E 001 51 12;425 ft;"Tours de piste côté ouest.


Présence d'un hangar à proximité du seuil 36 et d'une manche à air. Champs cultivés dégagés en prolongement des 2 QFU.


Attention : 2 lignes haute tension proches à 900m à l'ouest et diverses éoliennes à l'est de l'autoroute.";1;herbe;;40;750;'18-36;herbe;;;;'Inconnue;123.5;;0;invalid;albert.santilly@hotmail.fr;+33 6 30 04 09 74;"PPR au propriétaire et exploitant.


Piste en herbe très proche (100m) de l'autoroute Paris-Orléans et parfaitement parallèle à elle.


Activité de voltige le weekend et JF.


Créateur de ce terrain Fernand Richard


Bon état d'entretien, fiable. ";Albert Richard
;LF2827;Fontaine Simon;Aérodrome Privé Ouvert aux ULM;19/10/2011;21/10/2018;23/10/2018;48.50686139546237,0.9924906243218174;N 48 30 25;E 000 59 33;689 ft;"Aérodrome privé, PPR à Mr Mercier. 


Tour de piste côté Nord: à gauche en 06 et à droite en 24.


Survol interdit des Maisons Rouges et des hameaux.";1;herbe;;30;1000;'06-24;herbe;;;;'Inconnue;123.50;;0;invalid;Frederick.Mercier@wanadoo.fr;+33 6 10 34 62 60;Piste située à 9 nm au sud-ouest (gisement 207°) de l'ex-Base Aérienne de Dreux-Senonches.;
;LF2829;Voves Viabon;Aérodrome Privé Ouvert aux ULM;13/07/2011;21/10/2018;28/09/2025;48.211104568672,1.6733336448668998;N 48 12 40 ;E 001 40 24;476 ft;"ULM : Tour de piste à 500 ft à l'ouest. 


Avions : Tour de piste à 1000 ft à l'est.


! TAXIWAY SUPPRIMÉ !";1;herbe;'36;40;1000;'18-36;;;;;;123.450;;4;Gîte à proximité;service.commercial@jabiru.fr;+33 6 07 86 46 96;Aérodrome privé, PPR : appel téléphonique obligatoire avant de venir. Une tour télécom désaffectée à 1 nm au nord-est du terrain permet de le localiser facilement.;
;LF2830;Ecrosnes;Base ULM Accès limité Autorisation OBLIGATOIRE ;23/11/2011;28/03/2023;14/04/2023;48.560903050842,1.7305183410644531;N 48 33 39;E 001 43 50;520 ft;"TDP au NE à 1000 ft. VERTICALE 1500 ft.


Seuil décalé 85m pour la 31 et 60 m pour la 13.


Vent d'ouest, turbulences au niveau du bois.


Attention route au seuil de la 31


Taxiway le long de la piste - parking prés de la mare


message Radio + de sécurité";1;herbe;'13;22;220;'13-31;herbe;;;;'Inconnue;125.335;oui sur demande;2;Hangar possible;ed.monnier@wanadoo.fr;+33 6 09 22 09 61;"Tous les ULM et Hélicoptères sont les bienvenus,


Nous contacter au préalable au 06.09.22.09.61 ou 06.82.58.13.63 ou en vol sur 125.335


Un formulaire de mise à disposition de la piste doit être impérativement rempli et engagera la responsabilité du demandeur


Ravitaillement en carburant sur demande


Attention aux hélico et paramoteurs atterrissage et décollage de façon omnidirectionnelle


Utiliser la radio 125.335 (plafond 3000 ft SFC / 15 Nm)";
oui;LF2831;Brou La-Bretonnière;Base ULM Accès privé;07/10/2011;05/08/2015;22/11/2015;48.238344321285,1.1669325828552246;N 48 14 18;E 001 10 01;577 ft;;1;herbe;'21;30;350;'03-21;herbe;;;;'Inconnue;123.5;;;;;+33 2 37 47 06 86;;
;LF2834;Les Ailes d'Eure et Loir;Aérodrome Privé Ouvert aux ULM;31/10/2011;11/03/2017;18/05/2021;48.59230130713,1.5376076507568541;N 48 35 32;E 001 32 15;480 ft;"Aérodrome privé.


Tour de piste au Nord-est, 1000 ft QNH.


Seuil décalé en 15.





Paramoteurs secteur Sud.";1;herbe;'33;40;560;'15-33;herbe;;;;'Inconnue;123.500;;0;invalid;mbriffaud@free.fr;+33 6 80 92 02 62;"Terrain privé à usage limité aux aéronefs basées, l'accès à ce terrain (avions ou Ulm) est assujetti d'une demande préalable au président par tél 06 80 92 02 62 ou mail : mbriffaud@free.fr





Éviter systématiquement le survol de Néron et du hameau de Bois-Richeux.


Présence de drones civils à proximité du terrain.





Passage peu fréquent de sangliers et présence de taupinières. S'assurer de l'état de la piste avant l'atterrissage.";Les Ailes d'Eure et Loir
;LF2851;Houville La Branche;Base ULM Autorisation OBLIGATOIRE ;19/10/2011;09/04/2017;14/04/2023;48.453118036938,1.6298604011535645;N 48 27 11;E 001 37 47;496 ft;"Respecter 1000 ft en verticale terrain à l'arrivée.


Tour de piste à 500 ft au nord.


Survol de HOUVILLE et des trois villages situés en tour de piste interdit. Faire l'étape de base ou la branche traversière avant le chemin parallèle à la départementale.";1;herbe;'08;50;450;'08-26;herbe;;;;'Inconnue;125.335;;;;espace-houville-ulm@orange.fr;+33 2 37 25 75 43;;
oui;LF2853;Le Gault Saint Denis;Base ULM fermée définitivement;30/10/2011;28/09/2023;15/12/2024;48.218446647927,1.4962005615234375;N 48 13 06;E 001 29 46;446 ft;"Piste inutilisable





circuit à 150m/sol à l'est 


 


Atterrissage QFU 36 : seuil décalé de 150m


Survol du village et Hameau interdit.";1;herbe;;24;350;'18-36;herbe;;;;'Inconnue;125.335;sur demande;6,2,4;Restauration &agrave proximité, Hangar possible, Gîte à proximité;;+33 6 08 47 17 00;Hangar suivant disponibilité;
;LF2854;La Saussaye;Base ULM Autorisation OBLIGATOIRE ;18/06/2011;04/06/2025;06/06/2025;48.412382540335,1.5539002418518066;N 48 24 45;E 001 33 14;495 ft;"Tour de piste 500ft QFE (1000ft QNH) par le NW.


Survol du site de La Saussaye interdit (lycée agricole), bois et ferme compris.


Evitez les villages environnants (Bonville, Brétigny, Gellainville).


Ne pas faire plusieurs tours de piste.";1;herbe;;20;450;'03-21;herbe;;;;'Inconnue;125.335;sur demande;5;Camping possible;cbaete@ffplum.org;+33 6 09 84 30 41;"Autorisation obligatoire 


La piste est en très légère montée de chaque coté avec une bosse dans son milieu et en entrée de piste 03. Elle est bordée d'un chemin communal, retardez votre atterrissage/décollage en cas d'utilisation (promeneurs).


Les hangars sont derrière le petit bois à 200m de la piste. Attention au mat de manche à air au taxiage, risque de choc avec l'aile. Parking sur la dalle en béton devant les hangars.";Base ULM du Pays Chartrain
;LF2855;La maison des pionniers;Base ULM Accès privé;03/12/2011;24/12/2015;14/04/2023;48.8243063907462,1.58378005027771;N 48 49 28;E 001 35 02;360 ft;Terrain privé : PPR : permission préalable obligatoire. Éviter absolument le survol de toute habitation (problèmes de voisinage !);1;herbe;;0;450;'13-31;herbe;;;;'Inconnue;125.335;;0;invalid;bernard.afchain@cegetel.net;+33 6 07 16 69 13;PLATEFORME INCLUSE DANS UNE ZONE REGLEMENTEE ACTIVEE PAR NOTAM. EN CAS D'ACTIVATION DE LA ZONE LE SURVOL DE LA PLATEFORME EST FORTEMENT DECONSEILLE.;PROPRIETAIRE
;LF2856;Le Buternay;Aérodrome Privé Avec Restrictions Autorisation OBLIGATOIRE ;08/03/2011;03/07/2023;05/07/2023;48.612024708192,0.8419869153442505;N 48 36 43;E 000 50 31;817 ft;;1;herbe;;30;620;'17-35;herbe;;;;'Inconnue;123.500;;0;invalid;christophehoud@gmail.com;+33 6 58 22 38 21;ACCES Strictement interdit;Christophe HOUDAILLE
;LF2857;Club PPO;Base Paramoteurs Privée Ouverte aux ULM sur autorisation;26/09/2011;24/12/2015;25/01/2026;48.767420,1.540618;N 48 46 03;E 001 32 26;433 ft;;1;herbe;;100;200;'omnidir;;;;;;125.335;;6;Restauration &agrave proximité;jean-marie_bidaud@orange.fr;33 688 593 062;"Ecole Uranus Paramoteur présente sur le terrain.


Piste homologuée uniquement classe paramoteur





Gestionnaire : Le Club PPO (paramoteur Paris Ouest) 06 88 59 30 62";Le Club PPO
oui;LF2858;club du Houssay;Base ULM fermée définitivement;19/11/2011;18/07/2021;15/12/2024;48.227006869365,1.3851971820074596;N 48 13 37;E 001 23 07;429 ft;"TDP à l'est, éviter les pistes à chevaux.


Atterrissage en 36 : seuil décalé de 50m, faire attention à l'atterrissage nord, nord/est, il y a des rabattants avec le bois. Verticale 1000 pieds, par vent nul ou traversier, préférentielle pour att 18.";1;herbe;'18;40;304;'18-36;herbe;;;;'Inconnue;123.500;;0;invalid;mestro28ef@wanadoo.fr;+33 1 06 14 57 08 30;"Survols de Montboissier et de St-Germain interdits pour cause de nuisances.


PPR obligatoire : 06 14 57 08 30. 


Réservé aux actifs basés et à ceux invités. 


Tour de piste 650 ft à l'EST des installations, que ce soit en 18 ou en 36, en éloignement des pistes à chevaux. 





NOUVELLE PISTE A PROXIMITE DE LA RN10.  ";président
;LF2859;Les Ailes d'Horus;Base Paramoteurs Privée Ouverte aux ULM sur autorisation;28/10/2011;24/12/2015;25/01/2016;48.492207895459224,1.7631769180297852;N 48 29 32;E 001 45 47;501 ft;PARAMOTEURS;1;herbe;;120;140;'omnidir;herbe;;;;'Inconnue;;;6;Restauration &agrave proximité;romain.biegnon@dbmail.com;+33 6 87 61 60 29;"Tous les jours de 9h30 à 12h30 (sur RDV)& de 14h30 au coucher du soleil





Le terrain  homologué EXCLUSIVEMENT PARAMOTEUR.





Sens d’atterrissage et de décollage omnidirectionnel.


La plateforme est réservée aux paramotoristes.


Survol interdit des agglomérations et des hameaux environnants";Biegnon Romain
