;LF4226;Cret de Montieux;Aérodrome Privé Avec Restrictions Autorisation OBLIGATOIRE ;08/03/2011;21/08/2024;22/08/2024;45.463927350754,4.607767677307265;N 45 27 50;E 004 36 28;2384 ft;"Aérodrome privé de type altisurface. 





Atterrissage en 16, décollage en 34. 





Terrain interdit si présence de moutons sur le site.


Sol irrégulier. 





Piste sur un dôme, fortes turbulences possibles.";1;herbe;'16;20;200;'16-34;herbe;;;;'Inconnue;123.500;;0;invalid;eddy@linked.fr;+33 6 33 38 14 59;"Aérodrome strictement privé, autorisation nécessaire.


Qualification montagne obligatoire en avion.


Fort dévers de part et d'autre de l'axe.


Sol irrégulier, clôture en bout de piste.


Atterrissage interdit en présence des moutons.


Survol des habitations interdit.


2 atterrissages maximum / jour


Située sur le territoire du Parc Régional du Pilat.


";
oui;LF4227;Champdieu;Base ULM Réglementé Avec Restrictions Autorisation OBLIGATOIRE ;05/12/2011;04/09/2012;04/09/2012;45.638257334646,4.0609502792358;N 45 38 18;E 004 03 39;1250 ft;"Seuils décalés - Longueur utilisable: 290 m - Longueur totale: 380 m


Tour de piste à l'Est - > 500 ft sol


Vent arrière: verticale route


Survol habitations avoisinantes et village de Champdieu interdit


Attention: Ligne EDF-HTA en finale 0";1;herbe;'02;20;200;'02-20;;;;;;Auto-info 123.5;Sur demande;6,4;Restauration &agrave proximité, Gîte à proximité;contact@wing-over.fr;+33 6 18 46 12 65;;WING-OVER - Air Sports
oui;LF4228;Base ULM du Forez;Base ULM fermée définitivement;03/09/2012;29/09/2018;30/09/2018;45.638011084733,4.060860865087875;N 45 38 17;E 004 03 39;1254 ft;"Seuils décalés - Longueur utilisable: 290 m - Longueur totale: 380 m


Tour de piste à l'Est à 500 ft sol minimum





Ligne EDF HT matérialisée en trouée 02 (visible sur photo)





Survol du village de Champdieu et des habitations voisines interdit";1;herbe;'02;20;380;'02-20;herbe;;;;'Inconnue;123.500 MHz;Sur demande;6,4;Restauration &agrave proximité, Gîte à proximité;contact@guillaumerichard.com;+33 6 65 43 20 36;;Guillaume RICHARD
;LF4229;Maubeu;Aérodrome fermé.;14/12/2013;28/10/2022;18/12/2025;45.493299045169,4.46390105042417;N 45 29 36;E 004 27 50;1650 ft;"att 06 pente 30% sur 30m et 20% sur 130m


PPR obligatoire";1;herbe;'06;25;150;'06-24;herbe;;;;'Inconnue;123.065;;6,4;Restauration &agrave proximité, Gîte à proximité;;;"Terrain de type altisurface.


Pas de remise de gaz possible en finale, un seul tdp , absence de plateforme, parking difficile.";
;LF4230;La jalabertière;Base ULM Privé Avec Restrictions Autorisation OBLIGATOIRE ;02/05/2020;01/03/2023;14/04/2023;45.483885359591824,4.467835343872082;N 45 29 02;E 004 28 04;1755 ft;Éviter les habitations au nord et la ville de Sorbiers;1;herbe;;40;400;'18-36;herbe;;;;'Inconnue;125.335;possible;6,2,5,1;Restauration &agrave proximité, Hangar possible, Camping possible, Atelier ULM;louisulm@free.fr;+33 6 21 19 08 85;En pente, ATTERRISSAGE face au nord et DÉCOLLAGE face sud;LOUISULM
;LF4321;Mazeyrat;Aérodrome Privé Ouvert aux ULM;08/08/2011;25/01/2016;13/04/2022;45.107994274694,3.5035098227233448;N 45 06 29;E 003 30 13;1700 ft;"Aérodrome privé, autorisation obligatoire.


Survol de l'usine au bout de la piste 33 interdit (site sensible surveillé).";1;herbe;'33;70;460;'15-33;herbe;;;;'Inconnue;123.500;;0;invalid;;+33 6 38 86 49 14;"Piste non fauchée du 1er mai au 1er juillet. Écolage interdit sur le terrain.


Club LAPLUM créé en 1988 et réactivé depuis juillet 2011.


Pour une autorisation d'atterrissage, contacter :


- Jean-Claude Breuil, président, 06 38 86 49 14";Club ULM LAPLUM
;LF4323;Les Vastres;Base ULM Fermée temporairement ;09/11/2011;13/03/2025;15/03/2025;44.98541163219,4.26743745803833;N 44 59 07;E 004 16 03;3706 ft;"Intégration main gauche aux deux QFU





ULM rapide, expérience exigée





Pas d'atterrissage si pas de manche à air (Piste non praticable)





Pas de survol sur le stade de football 


";1;herbe;;40;250;'15-33;herbe;;;;'Inconnue;125.335;sur demande;6,4,5;Restauration &agrave proximité, Gîte à proximité, Camping possible;ulmvastres@gmail.com;+33 6 46 09 22 43;"piste à 800 m au SE du village des Vastres 


Camping possible (sans commodité)





Chambres d'hôtes: 'La rose des vents' Tél: 04 71 75 55 34 ou 06 36 92 13 89

















";
;LF4324;Beaux;Base ULM Accès privé;02/08/2023;22/08/2023;24/08/2023;45.1911683646952,4.089782573679828;N 45 11 28;E 004 05 23;2340 ft;"Interdiction de survol du village de Beaux au sud.


Atterrissage en 22 et décollage en 04  à PRIORISER.


";1;herbe;'22;25;100;'04-22;herbe;;;;'Inconnue;125.335;non;0;invalid;bechardgilbert@gmail.com;+33 6 08 62 82 15;"Autorisation écrite obligatoire avant utilisation.


Tour de piste à l'Est, sans dépasser le seuil de la piste 04.


Ligne électrique à moins de 100 m du seuil 04


Ligne très haute tension au nord.";Gilbert Béchard
;LF4325;Lapte;Base ULM Accès limité Autorisation OBLIGATOIRE ;27/02/2026;02/03/2026;02/03/2026;45.165824,4.211155;N 45 09 57;E 004 12 40;;"Cette plate-forme se situe :


A proximité de lieux d'habitations, interdiction de survol des habitations environnantes.


A l'intérieur du SETBA1 ARDECHE (surface /500 ft ASFC), secteur dédié à la réalisation d'activités aériennes militaires à très basse altitude.


Les utilisateurs  doivent adopter la plus grande prudence lors des évolutions dans le SETBA précité. 


la zone d'envol de 350 mètres direction EST devra toujours être priorisé.";1;herbe;;;;'09-27;;;;;;125.335;oui;1,2,4,5,6;Atelier ULM, Hangar possible, Gîte à proximité, Camping possible, Restauration &agrave proximité;contact@altitude840.fr;33608628215;Autorisation écrite obligatoire;BECHARD Gilbert
;LF4326;Adiac;Base ULM Réglementé Avec Restrictions Autorisation OBLIGATOIRE ;05/03/2026;05/03/2026;05/03/2026;45.127400,3.959130;N 45 07 39;E 003 57 33;1998 ft;Ligne HT sud ouest-nord est;1;herbe;'18;40;250;'18-36;;;;;;125,335;;4,6;Gîte à proximité, Restauration &agrave proximité;lucbongiraud@orange.fr;;Autorisation écrite préalable obligatoire.;L B
oui;LF4422;Plessé;Base ULM Accès privé;08/03/2011;13/01/2016;14/08/2016;47.525910456293,-1.841292621673574;N 47 31 33;W 001 50 29;131 ft;;1;herbe;;15;300;'03-21;herbe;;;;'Inconnue;Auto info 123.5;;2;Hangar possible;contact@solokart.com;+33 6 09 34 89 19;Base ré-ouverte.;Solokart
;LF4423;Saint Brévin les Pins;Base ULM ouverte tous types;01/12/2011;23/06/2023;25/06/2023;47.271309160536,-2.1303176879882812;N 47 16 17;W 002 07 49;10 ft;"Piste en dur prioritaire: TDP au Nord 500ft. 


Piste en herbe : TDP par l'Est 500ft. Fermée l'hiver humidité


Pas d'utilisation simultanée.


Éviter P8 matérialisée par le bord de Loire. Pas de survol de la Loire entre Paimboeuf et le pont de St Nazaire.";2;dur;'27;20;220;'09-27;herbe;'18;20;150;'18-36;125.335;non;0;invalid;ulm-cotedejade@orange.fr;+33 7 83 36 55 11;"Eviter survol du village au Sud des installations.





Pratique paramoteur et aérostat interdites par arrêté préfectoral.





Présence possible de caravanes de gens du voyage à proximité des pistes, ";ULM COTE DE JADE
;LF4451;Frossay;Base ULM ouverte tous types;10/04/2011;02/08/2024;04/08/2024;47.23906004282,-1.8776697619018705;N 47 14 21;W 001 52 40;10 ft;"Attention différents tours de pistes: 500 ft aal. Sens des tours de pistes : côté sud pour les 10/28 et 11/29, côté ouest pour la 18/36. 


Respectez les zones de survol interdit. Ne pas survoler les habitations proches du terrain (problèmes de voisinage).";2;dur;'1;12;230;'11-29;herbe;;15;340;'10-28;125.335;Sur Demande Tél;2,1;Hangar possible, Atelier ULM;eric.laskar@wanadoo.fr;+33 07 81 431 431;"Par pure politesse et sécurité, merci d'appeler avant de venir.


Plateforme fermée le mardi. Les pistes en herbe peuvent être inutilisables : sanglier, foin


Utilisez par sécurité la piste en dur.


C'est une Base ULM. Radio et Transpondeur ne sont pas obligatoires, c'est du vol à vue comme en 1910.


Pour la sécurité, il suffit d'ouvrir l’œil et non de parler dans sa radio sans regarder dehors


Attention au chien du propriétaire (Looping)";SCI AIGLE BLANC
;LF4452;La Planche;Base ULM Privé Avec Restrictions Autorisation OBLIGATOIRE ;11/07/2011;02/11/2024;24/11/2025;47.027824,-1.434445;N 47 01 40;W 001 26 04;105 ft;"Attention : lignes à haute tension à 300m du seuil 25.


TOUR DE PISTE : au nord de la base, à 2.5 km du terrain : ne pas survoler les hameaux et les fermes.


LES TOURS DE PISTE AU SUD SONT INTERDITS


A proximité de l'aérodrome de MONTAIGU: restez à l'écoute sur 123.500


Ecole et tours de piste  interdits";1;herbe;;20;400;'07-25;;;;;;125.335;;0;invalid;;+33 6 11 97 30 90;"Plateforme réservée aux ULM, interdite aux avions, hélicoptères, planneurs, drones et à tous les aéronefs qui ne sont pas classés ULM.


Autorisation préalable obligatoire  +33 6 11 97 30 90";AEROCLUB DE LA PLANCHE
;LF4453;Nantes Héric;Base ULM ouverte tous types;02/11/2011;16/03/2021;14/04/2023;47.385956821934,-1.6355459986792766;N 47 23 09;W 001 38 08;110 ft;"Verticale (1000) 1100 ft


Tour de Piste au Sud entre la piste et le village de la Grande Haie (500) 600 ft


Côté Ouest, virez si possible avant la RN137 (4 voies).


Attention !!! présence de paramoteurs!


Para : Evitez le survol des habitations proches";1;herbe;;30;320;'09-27;herbe;;;;'Inconnue;125.335;Sur demande;5;Camping possible;lesnezauvent@gmail.com;+33 6 29 56 76 12;"Plateforme sous la TMA (D) Nantes 1.1 : max 2500ft AMSL


Forte activité paramoteur sur le terrain (école)


Ecole Classes 1,2,3,4 


Impraticable en hiver ou en cas de fortes pluies sauf para (Nous contacter)


Consignes para:


- se poser côté nord piste, dégager l'aile rapidement


- éviter de poser le long du hangar (turbulences)


- intégration Nord 500 pieds


- tdp 300ft


- utilisation des extrémités de la piste interdite (pb de visibilité)


";"Club ULM les Nez Au Vent"""""
;LF4454;Le Quilloux;Aérodrome Privé Ouvert aux ULM;08/03/2011;02/01/2016;16/05/2021;47.59941297565,-1.9147873227539094;N 47 35 58;W 001 54 53;120 ft;"07 main droite


25 main gauche";1;herbe;;40;800;'07-25;herbe;;;;'Inconnue;123.500;;3;Restauration sur place;gilles.bertrand8@wanadoo.fr;+33 6 81 61 09 43;"Chambres d'hôtes + repas le soir 


Merci de téléphoner pour prévenir";Bertrand Gilles
;LF4455;La Possardière;Base ULM Autorisation OBLIGATOIRE ;09/07/2011;14/03/2023;14/04/2023;46.964556502458,-1.7033958435058594;N 46 57 52;W 001 42 12;65 ft;"Tour de piste par le sud.


Ne pas survoler le village !


La piste 12 est en descente ";2;herbe;;16;250;'12-30;herbe;;16;250;'02-20;125.335;;5;Camping possible;Caltimages@aol.com;+33 7 71 45 85 22;"Base située à 20 km de la mer.


      - plus de chambre d'hôte


      - plus de restauration sur place


      - les deux pistes sont ouvertes (12-30 et 02-20)


";Ber Claude
oui;LF4456;les Moisans;Base ULM fermée définitivement;05/08/2014;10/03/2023;15/12/2024;47.27606414710808,-2.0968563573442225;N 47 16 34;W 002 05 49;10 ft;"tour de piste par le nord. 500 pieds (pistes fermées à compter du 25/11/2022)





Survol de la Loire interdit (P8). 





Pas de survol du hameau.";2;herbe;'29;20;250;'11-29;herbe;;18;250;'04-22;125.335;;4;Gîte à proximité;emrener1@gmail.com;+33 6 03 21 38 44;" Gite : http://manoirdelesperance.fr/


Avant fermeture définitive de la base (préemption du conservatoire du littoral), les 2 pistes sont fermées (croix blanches de marquage au sol)";Mounès
;LF4457;Campbon La Berthelière;Base ULM ouverte tous types;14/01/2016;11/09/2021;14/04/2023;47.420833333333334,-2.0119444444444525;N 47 25 15;W 002 00 43;146 ft;"Tour de piste au nord  500ft


Verticale terrain 1000 ft


Piste 27 en légère montée.


Éoliennes à l'ouest du terrain.


Attention à la ligne electrique en seuil 09";1;herbe;'27;30;330;'09-27;herbe;;;;'Inconnue;125.335;Sur demande;5;Camping possible;philippeboussaud@orange.fr;+33 6 73 34 19 02;"Plateforme  sous CTR (D) de St Nazaire2 à 1500 ft.


Philippe vole souvent avec des oiseaux, surtout le matin ou le soir. Laissez-lui la priorité


Par courtoisie, appeler Philippe avant de venir. Vous serez toujours bien accueilli.


ULM club de l'Ouest basé sur le site Président et souvent là Daniel Pouvreau (habitant à 2km) 06 30 66 71 26 ou danielulm-pouvreau@orange.fr";Boussaud Philippe
;LF4458;St Brévin les Pins;Aérodrome Privé Avec Restrictions Autorisation OBLIGATOIRE ;24/10/2020;24/10/2020;06/11/2020;47.23641539526401,-2.1416734695434503;N 47 14 11;W 002 08 30;62 ft;"Tour de piste côté Nord à 1000 ft.


Eviter le survol des villages de 'Basse Lande' et 'La Lande' au sud-ouest.


Piste préférentielle 30 à l'ATR et 12 au DL, en cas d'approche en 12, faire une base très serrée pour éviter survol des habitations";1;herbe;'30;40;550;'12-30;herbe;;;;'Inconnue;recommandée Fq Club;Néant;2;Hangar possible;brossardlalande@wanadoo.fr;33 240 274 884;Aérodrome privé accessible uniquement aux pilotes autorisés et déclarés en préfecture par le gestionnaire, interdit à tout autre aéronef. Autorisation peut être accordée aux avions, hélicoptères, ULM classes 2, 3, 4 et 6. ;M. Jean-Yves BROSSARD
oui;LF4521;Montliard;Base ULM fermée définitivement;08/03/2011;07/06/2015;17/07/2015;48.023045969399,2.4141307830810774;N 48 01 23;E 002 24 51;357 ft;;1;herbe;;20;540;'14-32;herbe;;;;'Inconnue;123.5;néant;;;;;;
;LF4524;Ligny;Aérodrome privé fermé définitivement.;08/03/2011;10/12/2019;14/06/2021;47.70551081620332,1.778455634948708;N 47 42 20;E 001 46 42;371 ft;PPR au propriétaire, Mr Roger Communeau.;1;herbe;;;700;'08-26;herbe;;;;'Inconnue;;;0;invalid;;;;
;LF4525;La Selle en Hermoy;Base ULM Autorisation OBLIGATOIRE ;17/11/2011;03/05/2023;04/05/2023;48.016051686737,2.899811267852783;N 48 00 58;E 002 53 59;440 ft;"Utiliser la piste 22 à l'atterrissage et la piste 04 au décollage.


Pas de passage bas, ni de touch and go, car l'approche ou la remise de gaz serait dans le mauvais sens.


Par vent fort, terrain dangereux à cause des arbres entourant la piste.





";1;herbe;'22;20;350;'04-22;herbe;;;;'Inconnue;125.335;TOTAL à 1,5 Km;5;Camping possible;thierry.pujolle.45@gmail.com;+33 7 81 10 08 17;"Atterrissage en piste 22 préférentiel


Terrain situé à 12 km de Montargis et 13 km de Courtenay.


Village situé à 500 m au S/W de la piste.


Après une période pluvieuse, risque de zone inondée à 1/3 de la piste 04


Par vent fort, terrain à éviter à cause des turbulences causées par les arbres








     ";Particulier
oui;LF4551;Sandillon;Base ULM fermée définitivement;09/06/2011;21/04/2014;08/06/2015;47.82527286743345,2.059033455017129;N 47 49 31;E 002 03 33;360 ft;Ligne EDF haute tension à 500m au nord. Tour de piste à 150m sol à l'est Survol du bois au nord de la piste interdit Piste tendre et amoureuse en cas de fortes pluies;1;herbe;;30;450;'18-36;herbe;;;;'Inconnue;123.5;;;;;;Fermé depuis le 2 Avril 2014.;
;LF4552;Saint Benoit sur Loire;Base ULM ouverte tous types;05/11/2011;22/04/2025;24/04/2025;47.791479259993345,2.3373365423414043;N 47 47 29;E 002 20 14;367 ft;"Tour de piste 150m sol au SE. 


Survol village lieu-dit 'Les Places' interdit. 


Piste préférentielle 04 par vent travers ou nul


Seuil de piste décalé de 8O m en 04 cause chemin communal


";1;herbe;'04;20;300;'04-22;herbe;;;;'Inconnue;125.335;;4,5;Gîte à proximité, Camping possible;ulm.st.benoit@orange.fr;+33 2 38 35 76 78;"Attention : Soyez vigilants, risque de fouilles de sangliers sur piste et taxi.


Clôture électrique en début de piste 22, hauteur 0,70m";Association Loi 1901
;LF4553;Beaugency;Base ULM Autorisation OBLIGATOIRE ;09/04/2011;19/07/2025;09/03/2026;47.748875,1.578308;N 47 44 56;E 001 34 42;335 ft;"L'arrivée et le départ doivent se faire UNIQUEMENT par le NORD/NORD OUEST.


DÉPARTS : L'autoroute passée + 300 mètres, choisir sa route.


Pour une destination SUD attendre le dépassement de Mer pour prendre son cap.


Pour une destination EST attendre le dépassement de Beaugency pour prendre son cap.


Lors d'un décollage en 05, le survol des fermes est interdit.";1;herbe;;20;300;'05-23;;;;;;125.335;NON;0;invalid;air.centre.ulm@gmail.com;+33 7 64 23 59 62;"AUTORISATION IMPÉRATIVE AVANT TOUTE VENUE


MERCI DU STRICT RESPECT DES CONSIGNES





TERRAIN A PROXIMITE DE LA P34 ET SOUS LA R149A.





Le seuil de piste QFU23 est identifié par 3 cônes de chaque côté.";AIR CENTRE ULM
oui;LF4554;Beaulieu-sur-Loire;Base ULM fermée définitivement;08/03/2011;10/01/2025;06/04/2025;47.557566673404,2.8254896772460825;N 47 33 27;E 002 49 32;443 ft;"Circuit au SO pour les Paramoteurs.


Circuit au NE (vers la Loire) pour les autres classes, 1200 fts QNH.


Par vent fort travers, attention aux turbulences. Se poser le plus possible en milieu de piste.


";1;herbe;;12;600;'15-33;herbe;;;;'Inconnue;125.335;Sur demande Tel;3,6,2,4,5;Restauration sur place, Restauration &agrave proximité, Hangar possible, Gîte à proximité, Camping possible;peter.bracher4@gmail.com;+41 79 371 84 72;"Fermé temporairement depuis le 26/09/2023





Attention trous de lapins et taupes en dehors de piste et au roulage.


Roulage interdit hors de la piste, taxiway et parking.





Plate-forme ouverte tous les jours.





Canoë kayak sur place.


Possibilité de camping et restauration.





Attention ! A 6km en amont du fleuve (sud), centrale nucléaire de Belleville, avec une zone interdite 5 km autour.";
;LF4555;Mardié;Base ULM Autorisation OBLIGATOIRE ;08/03/2011;09/01/2025;05/02/2026;47.903611,2.067778;N 47 54 13;E 002 04 04;365 ft;"Tour de piste au Nord à 500 ft, ne pas survoler Mardié et Chécy au Sud. 





Attention école paramoteur, beaucoup d'activités paramoteur. 





Faites-vous voir avant de poser.";1;herbe;;40;300;'07-25;;;;;;125.335;;0;invalid;president@ucom-paramoteur.fr;+33 6 70 49 86 78;;Club UCOM : ULM club Orléans Mardié
;LF4556;Marsainvilliers;Base ULM Autorisation OBLIGATOIRE ;29/09/2011;26/07/2020;14/04/2023;48.221641946572,2.261080741882324;N 48 13 18;E 002 15 40;416 ft;"Eviter le survol du hameau de Fresnes au sud, du village de Marsainvilliers à l'est, et du village d'Engenville au nord-ouest. 





Si vous vous posez sur la 11, respectez le seuil de piste décalé de 50 m par rapport à la route.";1;herbe;;20;300;'11-29;herbe;;;;'Inconnue;125.335;;0;invalid;ch.merle@wanadoo.fr;+33 6 87 06 31 95;"Tour de Piste au NORD


Aucun survol des 3 villages avoisinants la base :


- Engenville et sa coopérative agricole


- Marsainvilliers


- Hameau de Fresnes";
;LF4557;Villemoutier;Base ULM ouverte tous types;08/03/2011;10/12/2019;14/04/2023;47.970292698356,2.5735818941650423;N 47 58 13;E 002 34 25;328 ft;ne pas utiliser autrement qu'en secours  ;1;herbe;;;350;'03-21;herbe;;;;'Inconnue;125.335;;0;invalid;;;;
;LF4558;Cravant les Lilas;Base ULM Autorisation OBLIGATOIRE ;08/03/2011;28/05/2021;14/04/2023;47.83670210044272,1.6178366243286746;N 47 50 12;E 001 37 04;377 ft;;1;herbe;;24;380;'03-21;herbe;;;;'Inconnue;125.335;Oui;3,2,4;Restauration sur place, Hangar possible, Gîte à proximité;leslilaspele@gmail.com;+33 2 38 46 43 45;"Nous avons 4 grandes chambres d'hôtes tout confort, pour tous les visiteurs qui viendraient avec leurs propre ULM, 


Une cuisine est disponible pour les pilotes. 


Contactez Philippe Pelé au 02 38 46 43 45 ou 06 60 28 95 11. 


leslilaspele@gmail.com


http://www.les-lilas.org/ p";Mr Pelé Philippe
;LF4559;Egry;Base ULM Autorisation OBLIGATOIRE ;09/11/2011;24/12/2015;14/04/2023;48.106413886122,2.4480199813842773;N 48 06 23;E 002 26 53;361 ft;"Tour de Piste à l'est


Sur la 01, un chemin communal en seuil de piste...";1;herbe;;20;340;'01-19;herbe;;;;'Inconnue;125.335;;0;invalid;mtm.lenoble@orange.fr;+33 6 70 63 45 92;;Michel Lenoble
;LF4560;La Rosétaine;Base ULM ouverte tous types;22/01/2012;24/12/2015;14/04/2023;48.128198778454355,2.9373591719732985;N 48 07 42;E 002 56 14;429 ft;"Tour de piste obligatoire côté autoroute


manche à air en 09, éviter le survol du village et des hameaux.


longueur totale de la piste: 390 m. Taxiway de 18 m.";1;herbe;'09;40;300;'09-27;herbe;;;;'Inconnue;125.335;Sur demande;6;Restauration &agrave proximité;yvon.boyer@wanadoo.fr;+33 6 08 27 89 48;Respecter le tour de piste par le Nord , éviter le survol du village et des hameaux.;Boyer Yvon
;LF4561;Les Avant Gardes;Aérodrome Privé Ouvert aux ULM;11/03/2012;22/06/2024;24/06/2024;47.81309235631353,2.235368296305296;N 47 48 47;E 002 14 07;350 ft;"Tour de piste au Nord


Éviter le survol des habitations


Piste turbulente par vent du nord et nord-est sur seuil 11.


Terrain gras après fortes averses.";1;herbe;;25;400;'11-29;herbe;;;;'Inconnue;123.500;Sur demande;6,4,5;Restauration &agrave proximité, Gîte à proximité, Camping possible;aero-lesavantgardes@orange.fr;+33 6 43 43 06 81;"Aerodrome privé soumis à autorisation préalable.


Contacter propriétaire pour formalités.


Camping possible sur place .


Sanitaires avec douches H/F et personnes à mobilité réduite.


Association loi 1901 avec instructeurs Aero-Les Avant Gardes .


Sécurité : Un extincteur est situé à mi longueur de la piste dans un abri.





Documents téléchargeables après demande à l'adresse mail


aero-lesavantgardes@orange.fr";CABOURDIN DIDIER
;LF4562;St Germain;Base ULM Accès privé;07/08/2012;24/12/2015;14/04/2023;47.95826333283458,2.8433729171753157;N 47 57 30;E 002 50 36;450 ft;"Préférer la 10 à l'atterrissage, la 28 au décollage


Tour de piste main gauche (éviter le survol du village), dernier virage devant la ligne Haute Tension.";1;herbe;'10;30;210;'10-28;herbe;;;;'Inconnue;125.335;;0;invalid;;+33 6 87 07 31 05;;Jerome
oui;LF4563;Mézières lez Cléry;Aérodrome fermé.;12/12/2013;10/12/2019;23/08/2025;47.810833333333,1.8408333333333076;N 47 48 39;E 001 50 27;344 ft;"Aérodrome privé, exclusivement réservé au vol à voile. 


Utilisation du treuil.";1;herbe;;100;800;'01-19;herbe;;;;'Inconnue;122.50;;0;invalid;;+33 6 68 92 72 29;"Aérodrome privé, exclusivement réservé au vol à voile. 


Utilisation du treuil.";PLANEURS DE MEZIERES VAL DE LOIRE
oui;LF4564;AIR et ESPACE;Base ULM fermée définitivement;03/04/2017;08/10/2021;27/05/2022;48.042027556218,3.075995540618919;N 48 02 31;E 003 04 34;540 ft;Attention ! Terrain fermé;1;herbe;'21;20;350;'03-21;herbe;;;;'Inconnue;123.500;en ville à 1km;6,4;Restauration &agrave proximité, Gîte à proximité;airetespace@outlook.fr;+33 6 80 61 17 59;Attention ! Terrain fermé;AIR et ESPACE
;LF4565;ULM LA CAVE;Aérodrome Privé Ouvert aux ULM;29/04/2017;30/04/2017;02/05/2017;47.872222222222,2.4544444444443343;N 47 52 20;E 002 27 16;410 ft;"Verticale Terrain - observation manche à Air.


Ne pas survoller village secteur NW.


PPR obligatoire";1;herbe;;30;330;'14-32;herbe;;;;'Inconnue;;;;;claude-christiane@wanadoo.fr;+33 6 82 91 22 19;"Contacte : Mr & Mme BLIN


06 82 91 22 19";
;LF4566;La Ferté Saint Aubin;Base ULM Accès privé;01/10/2025;03/10/2025;07/10/2025;47.697040,1.895000;N 47 41 49;E 001 53 42;360 ft;Ne pas survoler les habitations environnantes.;1;herbe;'03;22;300;'03-21;;;;;;125.335;;0;invalid;aero.lfsa@gmail.com;;"Seuils 03 et 21 décalés à cause des arbres à chaque extrêmité


Base ulm privée


Autorisation obligatoire à demander à: aero.lfsa@gmail.com";aero lfsa
;LF4621;Calviac;Aérodrome Privé Ouvert aux ULM;08/03/2011;08/06/2025;10/06/2025;44.92716365038049,2.0681569671078304;N 44 55 38;E 002 04 05;2100 ft;"En piste 17 seuil décalé de 220 mètres permettant d'obtenir une trouée sous un plan de 7%,la longueur de roulement restante à l'atterrissage est alors de 400 mètres


En piste 35,un seuil décalé de 140 mètres permet d'obtenir une trouée sous un plan de 7%";1;dur;'17;5;600;'17-35;herbe;;;;'Inconnue;123.500;;0;invalid;a.condamine@orange.fr;+33 6 85 76 44 91;"AÉRODROME PRIVÉ.


Piste en dur très étroite et de profil convexe, Conditions aérologiques particulières pouvant être générées par le relief et les obstacles environnants (arbres situés à l'ouest  et aux seuils de pistes ). PISTE RÉSERVÉE AUX AÉRONEFS BASÉS.


";Alexandre Condamine
;LF4623;Lacave Le Frau;Aérodrome Privé Ouvert aux ULM;01/10/2011;18/07/2016;21/07/2016;44.841690423606,1.5891122817993164;N 44 50 30;E 001 35 21;980 ft;"bande goudronnée de 8.5 m. 


Montante au QFU 13, donc 13 préférentielle à l’atterrissage par vent faible à moyen.";1;dur;'13;0;630;'13-31;herbe;;;;'Inconnue;123.5;;6;Restauration &agrave proximité;sebastienlestrade@gmail.com;+33 6 03 60 00 19;;Lestrade Sébastien
;LF4624;Loupiac;Aérodrome privé fermé temporairement;01/08/2011;14/09/2020;15/09/2020;44.831411599134,1.4746149338616306;N 44 49 53;E 001 28 29;895 ft;"Aérodrome privé PPR obligatoire


Situé à 200m à l'est de la N20 (2x2 voies). 





Atterrissage préférentiel en 28 (légère pente)





Possibilité de rabattants en finale 28 en cas de vent de secteur ouest. ";1;herbe;'28;20;480;'10-28;herbe;;;;'Inconnue;123.500;;2;Hangar possible;gilles.fabre@wanadoo.fr;+33 6 75 40 33 05;;Gilles Fabre
